{
  "surface": "lsp-completion-timeline",
  "major_version": 3,
  "schema_version": 1,
  "compatibility": {
    "breaking_change_requires_major_bump": true,
    "breaking_change_requires_migration_note": true
  },
  "request": {
    "method": "workspace/executeCommand",
    "command": "bsl.getCompletionTimeline",
    "params_shape": {
      "optional_fields": [
        "limit",
        "request_id"
      ],
      "limit_bounds": {
        "minimum": 1,
        "maximum": 200,
        "default": 200
      }
    }
  },
  "response": {
    "version": 1,
    "retention_max_entries_default": 200,
    "trace_fields": [
      "trace_id",
      "request_id",
      "uri",
      "trigger_mode",
      "outcome",
      "started_at_ms",
      "total_duration_ms",
      "dominant_stage",
      "stages"
    ],
    "stage_fields": [
      "name",
      "status",
      "started_offset_ms",
      "duration_ms"
    ],
    "stage_statuses": [
      "completed",
      "cancelled",
      "failed",
      "skipped"
    ],
    "outcomes": [
      "ok_non_empty",
      "ok_empty",
      "fail_closed",
      "cancelled",
      "superseded",
      "handler_error"
    ]
  }
}
